{
  "version": "0.3.0",
  "project_name": "Demo Mapping",
  "output": {
    "width": 1920,
    "height": 1080,
    "background": "#000000"
  },
  "sources": [
    {
      "id": "source_1",
      "name": "Main Video",
      "type": "video",
      "url": "https://example.com/media/demo.mp4",
      "width": 1920,
      "height": 1080,
      "loop": true,
      "muted": true
    },
    {
      "id": "source_2",
      "name": "Logo",
      "type": "image",
      "url": "https://example.com/media/logo.png",
      "width": 1024,
      "height": 1024
    }
  ],
  "shapes": [
    {
      "id": "input_shape_1",
      "name": "Video Crop",
      "type": "quad",
      "vertices": [[0, 0], [1920, 0], [1920, 1080], [0, 1080]],
      "locked": false
    },
    {
      "id": "output_shape_1",
      "name": "Wall Shape",
      "type": "quad",
      "vertices": [[300, 200], [1400, 180], [1450, 850], [250, 900]],
      "locked": false
    }
  ],
  "mappings": [
    {
      "id": "mapping_1",
      "name": "Main Wall",
      "source_id": "source_1",
      "input_shape_id": "input_shape_1",
      "output_shape_id": "output_shape_1",
      "visible": true,
      "locked": false,
      "solo": false,
      "opacity": 1.0,
      "blend_mode": "normal",
      "depth": 0
    }
  ],
  "metadata": {
    "created_by": "Map Daddy",
    "created_at": "",
    "updated_at": ""
  }
}
